London-North-Western-South	0548	Line of route	ELR	Line of Route / Sector Description		Line of Route / Sector Description	M	Ch	M	Ch	165	166 RH M	168	170	171	172	175	180	195	220	221	Notes
London-North-Western-South	0548	MD736	DHF	Flyover Junction Summit	Limit of Electrification	Flyover Junction Summit – Limit of Electrification	0	68	1	37	E R1	N	N	N	N	N	N	N	N	N	N	R1 Prohibited with footsteps fitted
London-North-Western-South	0548	MD736	DHF	Limit of Electrification	Bletchley Flyover North Jn	Limit of Electrification – Bletchley Flyover North Jn	1	37	1	61	E R1	N	N	N	N	N	N	N	N	N	N	R1 Prohibited with footsteps fitted
London-North-Western-South	0548	MD736	DHF	Bletchley Flyover North Jn	Denbigh Hall South Jn	Bletchley Flyover North Jn – Denbigh Hall South Jn	1	61	1	73	E R1	N	N	N	N	N	N	N	N	N	N	R1 Prohibited with footsteps fitted
London-North-Western-South	0548	MD740	BFO	Flyover Jn (Summit)	Fenny Stratford Bletchley Flyover Jn	Flyover Jn (Summit) – Fenny Stratford Bletchley Flyover Jn	0	68	1	59	N	N	N	N	N	N	N	N	N	N	N
London-North-Western-South	0548	MD745	BSG	Bicester South Junction	Gavray Junction	Bicester South Junction – Gavray Junction	0	00	0	52	Y	N	Y	N	N	Y	N	N	N	N	N
London-North-Western-South	0548	MD801	WSJ1	Wolverhampton North Jn	Oxley, Stafford Road Jn (Change of Mileage)	Wolverhampton North Jn – Oxley, Stafford Road Jn (Change of Mileage)	143	52	142	79	N	N	Y	Y	N	N	Y	N	EH	Y	Y
London-North-Western-South	0548	MD801	WSJ2	Oxley, Stafford Road Jn (Change of Mileage)	Limit of Electrification	Oxley, Stafford Road Jn (Change of Mileage) – Limit of Electrification	143	02	143	65	N	N	Y	Y	N	N	Y	N	EH R1	Y	Y	R1 Prohibited between Oxley TRSMD and Limit of Electrification
London-North-Western-South	0548	MD801	WSJ2	Limit of Electrification	Madeley Jn	Limit of Electrification – Madeley Jn	143	65	156	19	N	N	Y	Y	N	N	Y	N	N	N	R1	R1 3mph Shifnal Down platform with deflated suspension
London-North-Western-South	0548	MD801	WSJ2	Madeley Jn	Route Boundary (GW731) (Abbey Foregate)	Madeley Jn – Route Boundary (GW731) (Abbey Foregate)	156	19	170	46	N	N	Y	Y	N	N	Y	N	N	N	R1 R2	R1 3mph Oakengates Up platform with deflated suspension R2 3mph Wellington Down Loop platform with deflated suspension
London-North-Western-South	0548	MD805	OXC	Bushbury (Oxley) Jn	Stafford Road Jn	Bushbury (Oxley) Jn – Stafford Road Jn	1	02	0	00	N	N	N	Y	N	N	Y	N	EH	Y	Y
London-North-Western-South	0548	MD810	MJI1	Madeley Junction	Site of Former Lightmoor Jn	Madeley Junction – Site of Former Lightmoor Jn	156	19	160	29	N	N	N	N	N	N	N	N	N	N	N
London-North-Western-South	0548	MD810	MJI2	Site of Former Lightmoor Jn	Ironbridge Power Station (NR Boundary)	Site of Former Lightmoor Jn – Ironbridge Power Station (NR Boundary)	156	19	160	29	N	N	N	N	N	N	N	N	N	N	N
