Western	0811	Line of Route	Line of Route / Sector Description	Line of Route / Sector Description		RA	2 Axled (MAX RA)	4 Axled (MAX RA)	Location of Speed restriction	Up	Down	Notes
Western	0811	GW940	Carmarthen Stn to Carmarthen Bridge Jn	Carmarthen Stn	Carmarthen Bridge Jn	8	10	10	
Western	0811	GW950	Whitland to Pembroke	Whitland	Pembroke	7	8	8	THROUGHOUT	40 MPH	40 MPH
Western	0811	GW950	Pembroke to Pembroke Dock	Pembroke	Pembroke Dock	6	8	8	THROUGHOUT	40 MPH	40 MPH
Western	0811	GW960	Clarbeston Rd to Milford Haven	Clarbeston Rd	Milford Haven	8	10	10	
Western	0811	GW970	Gulf Oil Branch to Waterston	Gulf Oil Branch	Waterston	8	10	10	
Western	0811	GW980	Herbrandston Jn to Robeston	Herbrandston Jn	Robeston	8	10	10	
